{
  "schemaVersion": 1,
  "implementationCommit": "bf28fd1e77a06effd9f3ccf1c46704cdd4d1bedc",
  "reviewDigest": "sha256:081343d76c12cc6a3d2e3a96b963b000f7bf33b118895a1d7decaf22bdf83a45",
  "taskStateDigest": "sha256:df7b1c7a1973882050de0e44fd7dc2500a367ee6e1108445feccd02fedb474c2",
  "acceptanceDigest": "sha256:ee7ff25e1841abce6d70a3235e119d1653c5415f31d89362f6438d7b3cc5a4ae",
  "acceptedBy": "runtime-maintainer-acceptance",
  "acceptedAt": "2026-08-30T22:10:00.000Z",
  "result": "PASS"
}
