{
  "schemaVersion": 1,
  "implementationCommit": "8159bdda342b4af390724b922d2e613598438b78",
  "reviewDigest": "sha256:58b67c50dffabced677305a74bd04e16cf99dee777b4e700fa4888991abf3ccf",
  "taskStateDigest": "sha256:4a212218b238b8ed9e938bfb85776d8b24701c6356d10fcbef5d2fa00970443b",
  "acceptanceDigest": "sha256:645bd5ad771ef7d01af1a17e2c0f3b756ea80f08e5f2454e3df716fdc09024de",
  "acceptedBy": "仓库维护者（当前会话）",
  "acceptedAt": "2026-08-30T13:53:52Z",
  "result": "PASS"
}
