{
  "schemaVersion": 1,
  "implementationCommit": "759d52ede70f497779d3e1223b26787bd9fef637",
  "reviewDigest": "sha256:5713adc835b48c1e17125f01fc2246827ce1007059a4095aebf9ea2121604913",
  "taskStateDigest": "sha256:8dc6218e48390cf0cf7477c3b5403512a618c6d1969d65ab2b3329d438eed5e3",
  "acceptanceDigest": "sha256:03db8a7b777a95c62f2b72bb94878129ff0f16581a3b24260c8cedb8229a1b81",
  "acceptedBy": "Runtime 维护者（Eridanus，门3 当轮明确同意）",
  "acceptedAt": "2026-08-31T20:30:00.000Z",
  "result": "PASS"
}
