{
  "schemaVersion": 1,
  "implementationCommit": "108d9cc41356ad3cd91905be41a738722a6726f5",
  "reviewDigest": "sha256:93eab6b28c4b723eb6f9caf1663db13b18e2d7124e194aea1c179c15f7471394",
  "taskStateDigest": "sha256:9f05d019ce80e5d38bc324afe95987f12d6dc062e92ee3ee49df064ca7614749",
  "acceptanceDigest": "sha256:96418b16770141278ec7de9ebcc2ec05bb28cc80718e5ec51e74b1bd6595151d",
  "acceptedBy": "维护者（门口表态，Claude 代笔转录）",
  "acceptedAt": "2026-09-01T13:40:00.000Z",
  "result": "PASS"
}
