{
  "schemaVersion": 1,
  "implementationCommit": "d2ce7a2ea5fad624dab711fe5e9bbfb60c07a655",
  "reviewDigest": "sha256:1e13a8af1b0fd3fa5d800f40e4dd7341ab4f075302061493c5b615f32d825aac",
  "taskStateDigest": "sha256:942e04e9aacc1b2b7379a370f185de735c6646c56199263a798e77e9003d2cb1",
  "acceptanceDigest": "sha256:bc08fa64e6e616f4ce55d72865d53927bd8469e62d18512f170529eef22afbdf",
  "acceptedBy": "维护者（验收门口表态「同意」，由 Claude 转录，非亲签）",
  "acceptedAt": "2026-09-01T23:10:00Z",
  "result": "PASS"
}
