{
  "schemaVersion": 1,
  "implementationCommit": "6e51e7a4046bfdbd222f51418ab3b9a29da0756b",
  "reviewDigest": "sha256:ed7e641fc0c090c7f568148e628522546accea49aa0d93cf8f2823786f1a98fb",
  "taskStateDigest": "sha256:04c0c1cdf62b7d2cc642f9ee6db4f7330db7c601bd72e66d832aab4bf66e4f1a",
  "acceptanceDigest": "sha256:e70db1a56e5dd57fced7eea8a3c2ace0256468b3fd000ec2e60a5da842d7eae9",
  "acceptedBy": "仓库维护者（历史迁移确认）",
  "acceptedAt": "2026-08-30T12:59:15Z",
  "result": "PASS"
}
