{
  "schemaVersion": 1,
  "implementationCommit": "7c4804f851606ec5c671371c011d985b947049b1",
  "reviewDigest": "sha256:8a50d319f273b094d03b7ce1d114a0996ef9df6c364b11aa98daf60c308953dd",
  "taskStateDigest": "sha256:a6c6b95a3f5de7ec573a23dab99ccf99b55f1076fbcba1b1420cfb8969cbbd1a",
  "acceptanceDigest": "sha256:431ada32dec0f0e419c9774f6e63ff42694bbd7fad3455ffea5951978c30aa9a",
  "acceptedBy": "Runtime maintainer acceptance",
  "acceptedAt": "2026-08-30T23:10:00Z",
  "result": "PASS"
}
