{
  "schemaVersion": 1,
  "implementationCommit": "bdaead9e78ca4dc18a5e4e69c91532cb8b4d1e02",
  "reviewDigest": "sha256:8c8b99b70930f4d91c44cc67731a03c2d998d8a7fd24f816fc96698e7be18fab",
  "taskStateDigest": "sha256:fe8e4b5bbefe6cabe4b97d227aab3c0afbccce182f2699e76f03abb6d5c8f4e2",
  "acceptanceDigest": "sha256:9d0e7636af2d47f2fc671641f0f4d7b17e382bbf67457f11a9dbd0d5513d19a1",
  "acceptedBy": "acceptance-session",
  "acceptedAt": "2026-08-30T19:34:00.000Z",
  "result": "PASS"
}
