{
  "schemaVersion": 1,
  "implementationCommit": "001563469a90887459721283ddcf7e72319b4cd5",
  "reviewDigest": "sha256:af6a663988e3853ec2c8824838aecd5c7eb3c1ace63329a1794f685e19415be4",
  "taskStateDigest": "sha256:b3780ab9b3ffb402fd3f63644679a3f707b5ba68ced35478800ab0bcff549933",
  "acceptanceDigest": "sha256:59024b811ff122d9190814f14630a40c367d62e8859bdbf76e207dcfc3eb5139",
  "acceptedBy": "维护者（门口表态，Claude 代笔转录）",
  "acceptedAt": "2026-09-01T03:55:16.843Z",
  "result": "PASS"
}
