{
  "schemaVersion": 1,
  "implementationCommit": "bad6b8eecca802d856157807497c75c7fcdcb127",
  "reviewDigest": "sha256:df9a1b952c6e087914b866a4bc5ebafb7ef423c399cd6fd56d8a8e5cded80938",
  "taskStateDigest": "sha256:234342cbc3030aec6ad73065552c509bc386a520c8d7e72d0fde4c14e87c0b7d",
  "acceptanceDigest": "sha256:491705685e3fffbaf516dd68e8697b615e4561e1f5e3ae447356104c3f316df2",
  "acceptedBy": "Runtime 维护者（Eridanus，门3 当轮明确同意）",
  "acceptedAt": "2026-09-01T00:05:00.000Z",
  "result": "PASS"
}
