{
  "schemaVersion": 1,
  "implementationCommit": "b23841b581a9f4441d1f61fedc09b24c5718b5ec",
  "reviewDigest": "sha256:0f7effbb5e9dbf67a2dc87d8417324ee8f7117535fb44f1a4a6b49def6343207",
  "taskStateDigest": "sha256:32ac7450630c4cfb6e04a0f8142c2acca470d30f15e3380e4ffcf9f368142d40",
  "acceptanceDigest": "sha256:2ca166693793ccad5d8fd7a99dafd7de238a58215a8074bd4404cc97f349151e",
  "acceptedBy": "Runtime 维护者",
  "acceptedAt": "2026-08-30T20:40:16.588Z",
  "result": "PASS"
}
