{
  "schemaVersion": 1,
  "implementationCommit": "db6d220daf3b06775f4b99c7c4aebb0ae1cc94bd",
  "reviewDigest": "sha256:3fd8fff281acc6aa005d534cc93fe670da69c14b304c3026f532bc87c8a71d58",
  "taskStateDigest": "sha256:db475030c3bcae5524d0d3f65b52cf4635f0f21b37cb438dde86ca1eeca1c905",
  "acceptanceDigest": "sha256:b9c4e1e725fff427b48e36c45cd41ce855d9672ece92abdb80be70fc2f2624f3",
  "acceptedBy": "当前会话维护者",
  "acceptedAt": "2026-08-30T12:42:10Z",
  "result": "PASS"
}
